id,title,slug,poster_url,director,country,year,film_type,plot,genres,poster_url,combined_features
72,Bóng Lửa,bong-lua,https://img.ophim.live/uploads/movies/bong-lua-thumb.jpg,塚本晋也,Nhật Bản,2023,Phim Lẻ,"Bộ phim lấy bối cảnh Nhật Bản sau Thế chiến II, xoay quanh một người phụ nữ sống trong quán rượu bị thiêu rụi, một đứa trẻ mồ côi chiến tranh lẻn vào để ăn trộm, và một cựu binh trở thành khách trọ. Sự chung sống mong manh của họ bị gián đoạn bởi quá khứ đầy ám ảnh của người lính.",Chiến Tranh|Chính Kịch,http://localhost:5173/images/movies/https://img.ophim.live/uploads/movies/bong-lua-thumb.jpg,"Bóng Lửa Bộ phim lấy bối cảnh Nhật Bản sau Thế chiến II, xoay quanh một người phụ nữ sống trong quán rượu bị thiêu rụi, một đứa trẻ mồ côi chiến tranh lẻn vào để ăn trộm, và một cựu binh trở thành khách trọ. Sự chung sống mong manh của họ bị gián đoạn bởi quá khứ đầy ám ảnh của người lính. Chiến Tranh|Chính Kịch 塚本晋也 Nhật Bản Phim Lẻ"
73,Bắt Đầu Từ Sự Kết Thúc,the-end-we-start-from,https://img.ophim.live/uploads/movies/the-end-we-start-from-thumb.jpg,Mahalia Belo,Âu Mỹ,2023,Phim Lẻ,"As London is submerged below floodwaters, a woman gives birth to her first child. Days later, she and her baby are forced to leave their home in search of safety. They head north through a newly dangerous country seeking refuge from place to place.",Bí Ẩn|Chính Kịch,http://localhost:5173/images/movies/https://img.ophim.live/uploads/movies/the-end-we-start-from-thumb.jpg,"Bắt Đầu Từ Sự Kết Thúc As London is submerged below floodwaters, a woman gives birth to her first child. Days later, she and her baby are forced to leave their home in search of safety. They head north through a newly dangerous country seeking refuge from place to place. Bí Ẩn|Chính Kịch Mahalia Belo Âu Mỹ Phim Lẻ"
74,Tình Yêu Giả Tạo,tinh-yeu-gia-tao,https://img.ophim.live/uploads/movies/tinh-yeu-gia-tao-thumb.jpg,Tao Sheng,Trung Quốc,2025,Phim Bộ,"Vưu Vưu mất mẹ và cha bị tù vì âm mưu của An Quốc Hiên. Cô vô tình làm Tề Đông, con trai An Quốc Hiên, bị mù và vứt xuống biển. Sau khi được cứu, Tề Đông tự lập công ty đối đầu với Tập đoàn Tinh Diệu. Năm năm sau, Vưu Vưu trở lại với danh tính mới, Tề Cách Cách, tiếp cận Tề Đông để trả thù, nhưng phát hiện anh cũng muốn báo thù An Quốc Hiên. Hai người hợp tác, nhưng một mối đe dọa lớn hơn đang rình rập.",Chính Kịch,http://localhost:5173/images/movies/https://img.ophim.live/uploads/movies/tinh-yeu-gia-tao-thumb.jpg,"Tình Yêu Giả Tạo Vưu Vưu mất mẹ và cha bị tù vì âm mưu của An Quốc Hiên. Cô vô tình làm Tề Đông, con trai An Quốc Hiên, bị mù và vứt xuống biển. Sau khi được cứu, Tề Đông tự lập công ty đối đầu với Tập đoàn Tinh Diệu. Năm năm sau, Vưu Vưu trở lại với danh tính mới, Tề Cách Cách, tiếp cận Tề Đông để trả thù, nhưng phát hiện anh cũng muốn báo thù An Quốc Hiên. Hai người hợp tác, nhưng một mối đe dọa lớn hơn đang rình rập. Chính Kịch Tao Sheng Trung Quốc Phim Bộ"
75,Hồn Ma Học Đường (Phần 2),hon-ma-hoc-duong-phan-2,https://img.ophim.live/uploads/movies/hon-ma-hoc-duong-phan-2-thumb.jpg,Đang cập nhật,Âu Mỹ,2025,Phim Bộ,"Maddie, một thiếu niên mắc kẹt ở thế giới bên kia để điều tra về sự mất tích của chính mình, bắt đầu hành trình giải quyết tội phạm khi cô thích nghi với nơi luyện ngục ở trường trung học.",Bí Ẩn|Chính Kịch,http://localhost:5173/images/movies/https://img.ophim.live/uploads/movies/hon-ma-hoc-duong-phan-2-thumb.jpg,"Hồn Ma Học Đường (Phần 2) Maddie, một thiếu niên mắc kẹt ở thế giới bên kia để điều tra về sự mất tích của chính mình, bắt đầu hành trình giải quyết tội phạm khi cô thích nghi với nơi luyện ngục ở trường trung học. Bí Ẩn|Chính Kịch Đang cập nhật Âu Mỹ Phim Bộ"
76,NCIS: Origins,ncis-origins,https://img.ophim.live/uploads/movies/ncis-origins-thumb.jpg,Đang cập nhật,Âu Mỹ,2024,Phim Bộ,"NCIS: Origins là phần tiền truyện của loạt phim truyền hình nổi tiếng NCIS, bộ phim tập trung vào hành trình của Leroy Jethro Gibbs thời trẻ, do Austin Stowell thủ vai, khi anh bắt đầu sự nghiệp tại Dịch vụ Điều tra Hải quân (NIS) vào năm 1991 tại Camp Pendleton.&nbsp;Đặc biệt, Mark Harmon, người đã thủ vai Gibbs trong suốt 19 mùa của NCIS, sẽ xuất hiện trong tập đầu của NCIS: Origins và đảm nhận vai trò người dẫn chuyện, mang lại sự kết nối giữa hai loạt phim.&nbsp;Bên cạnh đó, Kyle Schmid sẽ vào vai Mike Franks, người lãnh đạo nhóm và là nhân vật quen thuộc với người hâm mộ NCIS.Bộ phim hứa hẹn khám phá những câu chuyện chưa kể về Gibbs, mang đến cho khán giả cái nhìn sâu sắc về sự hình thành và phát triển của nhân vật biểu tượng này trong những ngày đầu sự nghiệp.",Chính Kịch|Hình Sự,http://localhost:5173/images/movies/https://img.ophim.live/uploads/movies/ncis-origins-thumb.jpg,"NCIS: Origins NCIS: Origins là phần tiền truyện của loạt phim truyền hình nổi tiếng NCIS, bộ phim tập trung vào hành trình của Leroy Jethro Gibbs thời trẻ, do Austin Stowell thủ vai, khi anh bắt đầu sự nghiệp tại Dịch vụ Điều tra Hải quân (NIS) vào năm 1991 tại Camp Pendleton.&nbsp;Đặc biệt, Mark Harmon, người đã thủ vai Gibbs trong suốt 19 mùa của NCIS, sẽ xuất hiện trong tập đầu của NCIS: Origins và đảm nhận vai trò người dẫn chuyện, mang lại sự kết nối giữa hai loạt phim.&nbsp;Bên cạnh đó, Kyle Schmid sẽ vào vai Mike Franks, người lãnh đạo nhóm và là nhân vật quen thuộc với người hâm mộ NCIS.Bộ phim hứa hẹn khám phá những câu chuyện chưa kể về Gibbs, mang đến cho khán giả cái nhìn sâu sắc về sự hình thành và phát triển của nhân vật biểu tượng này trong những ngày đầu sự nghiệp. Chính Kịch|Hình Sự Đang cập nhật Âu Mỹ Phim Bộ"
77,Thanh Xà: Duyên Khởi,thanh-xa-duyen-khoi,https://img.ophim.live/uploads/movies/thanh-xa-duyen-khoi-thumb.jpg,刘春,Trung Quốc,2025,Phim Lẻ,"Thanh Xà không ăn thịt người, chỉ ăn yêu quái, nhưng lại bị dân chúng ở thành Hàng Châu hiểu lầm. Nàng bị truy đuổi và tấn công, buộc phải trốn chạy trong tình trạng bị thương. Trên đường, Thanh Xà gặp Tiểu Quỷ, hai người kết bạn và đồng hành cùng nhau.  Thanh Xà tiến vào yêu vực, cố gắng cứu những yêu tộc bị bắt, nhưng lại bị nghi ngờ và xa lánh. Yêu Vương nhận ra năng lực của Thanh Xà và để nàng tiếp tục nhiệm vụ. Trong quá trình đồng hành cùng Tiểu Quỷ, Thanh Xà dần cảm nhận được những cảm xúc của con người, và giữa hai người nảy sinh một tình bạn sâu sắc.",Chính Kịch,http://localhost:5173/images/movies/https://img.ophim.live/uploads/movies/thanh-xa-duyen-khoi-thumb.jpg,"Thanh Xà: Duyên Khởi Thanh Xà không ăn thịt người, chỉ ăn yêu quái, nhưng lại bị dân chúng ở thành Hàng Châu hiểu lầm. Nàng bị truy đuổi và tấn công, buộc phải trốn chạy trong tình trạng bị thương. Trên đường, Thanh Xà gặp Tiểu Quỷ, hai người kết bạn và đồng hành cùng nhau.  Thanh Xà tiến vào yêu vực, cố gắng cứu những yêu tộc bị bắt, nhưng lại bị nghi ngờ và xa lánh. Yêu Vương nhận ra năng lực của Thanh Xà và để nàng tiếp tục nhiệm vụ. Trong quá trình đồng hành cùng Tiểu Quỷ, Thanh Xà dần cảm nhận được những cảm xúc của con người, và giữa hai người nảy sinh một tình bạn sâu sắc. Chính Kịch 刘春 Trung Quốc Phim Lẻ"
78,Những Người Còn Sót Lại (Phần 2),nhung-nguoi-con-sot-lai-phan-2,https://img.ophim.live/uploads/movies/nhung-nguoi-con-sot-lai-phan-2-thumb.jpg,Đang cập nhật,Âu Mỹ,2025,Phim Bộ,"After five years of peace following the events of the first season, Joel and Ellie's collective past catches up to them, drawing them into conflict with each other and a world even more dangerous and unpredictable than the one they left behind.",Chính Kịch,http://localhost:5173/images/movies/https://img.ophim.live/uploads/movies/nhung-nguoi-con-sot-lai-phan-2-thumb.jpg,"Những Người Còn Sót Lại (Phần 2) After five years of peace following the events of the first season, Joel and Ellie's collective past catches up to them, drawing them into conflict with each other and a world even more dangerous and unpredictable than the one they left behind. Chính Kịch Đang cập nhật Âu Mỹ Phim Bộ"
79,Phàm Nhân Tu Tiên,pham-nhan-tu-tien,https://img.ophim.live/uploads/movies/pham-nhan-tu-tien-thumb.jpg,Đang cập nhật,Trung Quốc,2020,Phim Hoạt Hình,"Thiếu niên là người phàm, lại không rõ từ đâu cơ thể có được căn nguyên linh khí. Vì để người nhà được sống cuộc sống tốt hơn, bèn bước vào cuộc hành trình tu tiên",Bí Ẩn|Hành Động|Phiêu Lưu,http://localhost:5173/images/movies/https://img.ophim.live/uploads/movies/pham-nhan-tu-tien-thumb.jpg,"Phàm Nhân Tu Tiên Thiếu niên là người phàm, lại không rõ từ đâu cơ thể có được căn nguyên linh khí. Vì để người nhà được sống cuộc sống tốt hơn, bèn bước vào cuộc hành trình tu tiên Bí Ẩn|Hành Động|Phiêu Lưu Đang cập nhật Trung Quốc Phim Hoạt Hình"
80,Phù Thủy Maebashi,phu-thuy-maebashi,https://img.ophim.live/uploads/movies/phu-thuy-maebashi-thumb.jpg,Đang cập nhật,Nhật Bản,2025,Phim Hoạt Hình,"Welcome to Maebashi City, Gunma Prefecture. For first-year high school student Yuina Akagi, her middling life takes a wild turn the moment a mysterious frog named Keroppe shows up and asks her, “Why don’t you become a witch?” Alongside Azu Niisato, Kyoka Kitahara, Choco Mitsumata, and Mai Kamiizumi, Yuina and her friends are excited to make people’s dreams come true as the Maebashi Witches.",Khoa Học|Viễn Tưởng,http://localhost:5173/images/movies/https://img.ophim.live/uploads/movies/phu-thuy-maebashi-thumb.jpg,"Phù Thủy Maebashi Welcome to Maebashi City, Gunma Prefecture. For first-year high school student Yuina Akagi, her middling life takes a wild turn the moment a mysterious frog named Keroppe shows up and asks her, “Why don’t you become a witch?” Alongside Azu Niisato, Kyoka Kitahara, Choco Mitsumata, and Mai Kamiizumi, Yuina and her friends are excited to make people’s dreams come true as the Maebashi Witches. Khoa Học|Viễn Tưởng Đang cập nhật Nhật Bản Phim Hoạt Hình"
81,"SHIROHIYO - Đầu thai thành quý tộc mập ú, tôi dùng ký ức kiếp trước để nuôi dạy em trai",shirohiyo-dau-thai-thanh-quy-toc-map-u-toi-dung-ky-uc-kiep-truoc-de-nuoi-day-em-trai,https://img.ophim.live/uploads/movies/shirohiyo-dau-thai-thanh-quy-toc-map-u-toi-dung-ky-uc-kiep-truoc-de-nuoi-day-em-trai-thumb.jpg,Đang cập nhật,Nhật Bản,2025,Phim Hoạt Hình,"Trong thế giới lấp lánh, huyền ảo này, có rất nhiều sự sang trọng và kỳ diệu! Những yêu tinh xinh đẹp và duyên dáng, những vị thần vượt quá tầm hiểu biết của con người, sức mạnh của phép thuật—mọi thứ đều giống như một giấc mơ.",Hài Hước|Hành Động|Khoa Học|Phiêu Lưu|Viễn Tưởng,http://localhost:5173/images/movies/https://img.ophim.live/uploads/movies/shirohiyo-dau-thai-thanh-quy-toc-map-u-toi-dung-ky-uc-kiep-truoc-de-nuoi-day-em-trai-thumb.jpg,"SHIROHIYO - Đầu thai thành quý tộc mập ú, tôi dùng ký ức kiếp trước để nuôi dạy em trai Trong thế giới lấp lánh, huyền ảo này, có rất nhiều sự sang trọng và kỳ diệu! Những yêu tinh xinh đẹp và duyên dáng, những vị thần vượt quá tầm hiểu biết của con người, sức mạnh của phép thuật—mọi thứ đều giống như một giấc mơ. Hài Hước|Hành Động|Khoa Học|Phiêu Lưu|Viễn Tưởng Đang cập nhật Nhật Bản Phim Hoạt Hình"
82,My Stubborn: Sao Anh Bảo Không Thích Trẻ Con,my-stubborn-sao-anh-bao-khong-thich-tre-con,https://img.ophim.live/uploads/movies/my-stubborn-sao-anh-bao-khong-thich-tre-con-thumb.jpg,Đang cập nhật,Thái Lan,2025,Phim Bộ,"Scarred by a past relationship, Sorn vows never to date anyone younger. However, meeting his sworn enemy Jun might just change his perspective.",Chính Kịch,http://localhost:5173/images/movies/https://img.ophim.live/uploads/movies/my-stubborn-sao-anh-bao-khong-thich-tre-con-thumb.jpg,"My Stubborn: Sao Anh Bảo Không Thích Trẻ Con Scarred by a past relationship, Sorn vows never to date anyone younger. However, meeting his sworn enemy Jun might just change his perspective. Chính Kịch Đang cập nhật Thái Lan Phim Bộ"
83,Dưới bóng trung điện,duoi-bong-trung-dien,https://img.ophim.live/uploads/movies/duoi-bong-trung-dien-thumb.jpg,Đang cập nhật,Hàn Quốc,2022,Phim Bộ,"Một trung điện mạnh mẽ cố rèn những đứa con gây rối vào khuôn phép để một trong số họ có thể trở thành vị vua tiếp theo của Joseon, trong khi các đối thủ ganh đua giành ngai vàng.",Chính Kịch|Cổ Trang,http://localhost:5173/images/movies/https://img.ophim.live/uploads/movies/duoi-bong-trung-dien-thumb.jpg,"Dưới bóng trung điện Một trung điện mạnh mẽ cố rèn những đứa con gây rối vào khuôn phép để một trong số họ có thể trở thành vị vua tiếp theo của Joseon, trong khi các đối thủ ganh đua giành ngai vàng. Chính Kịch|Cổ Trang Đang cập nhật Hàn Quốc Phim Bộ"
84,Công Chúa Ngổ Ngáo: Bạch Tuyết,cong-chua-ngo-ngao-bach-tuyet,https://img.ophim.live/uploads/movies/cong-chua-ngo-ngao-bach-tuyet-thumb.jpg,Đang cập nhật,Thái Lan,2022,Phim Bộ,"Vẻ đẹp của Bạch Tuyết đã từng là mối nguy hiểm của cô, nhưng đối với nàng Bạch Tuyết của hiện đại, ""xấu xí"" mới thật đáng sợ. Không có nhan sắc cô ấy bị tấn công bởi các phương tiện truyền thông, mạng xã hội. Cho dù bị bắt nạt đến mức nào, thì nàng Bạch Tuyết thời đại mới vẫn hiên ngang sống tốt.",Tâm Lý|Tình Cảm,http://localhost:5173/images/movies/https://img.ophim.live/uploads/movies/cong-chua-ngo-ngao-bach-tuyet-thumb.jpg,"Công Chúa Ngổ Ngáo: Bạch Tuyết Vẻ đẹp của Bạch Tuyết đã từng là mối nguy hiểm của cô, nhưng đối với nàng Bạch Tuyết của hiện đại, ""xấu xí"" mới thật đáng sợ. Không có nhan sắc cô ấy bị tấn công bởi các phương tiện truyền thông, mạng xã hội. Cho dù bị bắt nạt đến mức nào, thì nàng Bạch Tuyết thời đại mới vẫn hiên ngang sống tốt. Tâm Lý|Tình Cảm Đang cập nhật Thái Lan Phim Bộ"
85,Bếp trưởng bếp ăn vặt,bep-truong-bep-an-vat,https://img.ophim.live/uploads/movies/bep-truong-bep-an-vat-thumb.jpg,Đang cập nhật,Anh,2022,Phim Bộ,"Để các nhà khoa học thực phẩm trong họ có cơ hội tỏa sáng, 12 đầu bếp làm lại các món ăn vặt kinh điển và sáng tạo ra các món ngọt riêng nhằm giành giải thưởng 50.000 USD.",Gia Đình,http://localhost:5173/images/movies/https://img.ophim.live/uploads/movies/bep-truong-bep-an-vat-thumb.jpg,"Bếp trưởng bếp ăn vặt Để các nhà khoa học thực phẩm trong họ có cơ hội tỏa sáng, 12 đầu bếp làm lại các món ăn vặt kinh điển và sáng tạo ra các món ngọt riêng nhằm giành giải thưởng 50.000 USD. Gia Đình Đang cập nhật Anh Phim Bộ"
86,Firefly Lane (Phần 1),firefly-lane-phan-1,https://img.ophim.live/uploads/movies/firefly-lane-phan-1-thumb.jpg,Đang cập nhật,Âu Mỹ,2022,Phim Bộ,Chẳng trở ngại nào là quá lớn trước tình bạn suốt đời giữa Kate và Tully. Nhưng liệu có sai lầm nào có thể chia cắt họ mãi mãi hay không?,Chính Kịch,http://localhost:5173/images/movies/https://img.ophim.live/uploads/movies/firefly-lane-phan-1-thumb.jpg,Firefly Lane (Phần 1) Chẳng trở ngại nào là quá lớn trước tình bạn suốt đời giữa Kate và Tully. Nhưng liệu có sai lầm nào có thể chia cắt họ mãi mãi hay không? Chính Kịch Đang cập nhật Âu Mỹ Phim Bộ
87,Hot Skull,hot-skull,https://img.ophim.live/uploads/movies/hot-skull-thumb.jpg,Đang cập nhật,Thổ Nhĩ Kỳ,2022,Phim Bộ,"Ở thế giới phản địa đàng, trước một dịch bệnh lây lan qua đường giao tiếp bằng lời nói, một tổ chức chuyên chế nhắm đến một nhà ngôn ngữ học miễn nhiễm với căn bệnh này.",Chính Kịch|Khoa Học|Viễn Tưởng,http://localhost:5173/images/movies/https://img.ophim.live/uploads/movies/hot-skull-thumb.jpg,"Hot Skull Ở thế giới phản địa đàng, trước một dịch bệnh lây lan qua đường giao tiếp bằng lời nói, một tổ chức chuyên chế nhắm đến một nhà ngôn ngữ học miễn nhiễm với căn bệnh này. Chính Kịch|Khoa Học|Viễn Tưởng Đang cập nhật Thổ Nhĩ Kỳ Phim Bộ"
88,Romesh Ranganathan: Người hoài nghi,romesh-ranganathan-nguoi-hoai-nghi,https://img.ophim.live/uploads/movies/romesh-ranganathan-nguoi-hoai-nghi-thumb.jpg,Benjamin Green,Anh,2022,Phim Bộ,"Trở lại quê nhà ở Crawley, Anh, Romesh Ranganathan bông đùa về chủ nghĩa thuần chay, các con và hé lộ quá trình thực hiện chương trình hài đặc biệt của mình.",Hài Hước|Tài Liệu,http://localhost:5173/images/movies/https://img.ophim.live/uploads/movies/romesh-ranganathan-nguoi-hoai-nghi-thumb.jpg,"Romesh Ranganathan: Người hoài nghi Trở lại quê nhà ở Crawley, Anh, Romesh Ranganathan bông đùa về chủ nghĩa thuần chay, các con và hé lộ quá trình thực hiện chương trình hài đặc biệt của mình. Hài Hước|Tài Liệu Benjamin Green Anh Phim Bộ"
89,Ngày Mai Sẽ Tốt Hơn,ngay-mai-se-tot-hon,https://img.ophim.live/uploads/movies/ngay-mai-se-tot-hon-thumb.jpg,Đang cập nhật,Trung Quốc,2022,Phim Bộ,"Phim kế về tình cảm bất hoà của một đôi bạn thân như chị em ruột, từ thân thiết bầu bạn cùng nhau trở nên đố kỵ hận thù, đề cao chân thiện mỹ trong nhân tính, soi ra cái ác cái xấu trong lòng người.",Tình Cảm,http://localhost:5173/images/movies/https://img.ophim.live/uploads/movies/ngay-mai-se-tot-hon-thumb.jpg,"Ngày Mai Sẽ Tốt Hơn Phim kế về tình cảm bất hoà của một đôi bạn thân như chị em ruột, từ thân thiết bầu bạn cùng nhau trở nên đố kỵ hận thù, đề cao chân thiện mỹ trong nhân tính, soi ra cái ác cái xấu trong lòng người. Tình Cảm Đang cập nhật Trung Quốc Phim Bộ"
90,Người chăm voi,nguoi-cham-voi,https://img.ophim.live/uploads/movies/nguoi-cham-voi-thumb.jpg,Kartiki Gonsalves,Ấn Độ,2022,Phim Lẻ,"Bomman và Bellie là một cặp đôi ở miền nam Ấn Độ. Họ dành cả cuộc đời để chăm sóc cho bé voi mồ côi tên là Raghu, qua đó tạo nên một gia đình vô cùng đặc biệt.",Gia Đình|Khoa Học|Tài Liệu,http://localhost:5173/images/movies/https://img.ophim.live/uploads/movies/nguoi-cham-voi-thumb.jpg,"Người chăm voi Bomman và Bellie là một cặp đôi ở miền nam Ấn Độ. Họ dành cả cuộc đời để chăm sóc cho bé voi mồ côi tên là Raghu, qua đó tạo nên một gia đình vô cùng đặc biệt. Gia Đình|Khoa Học|Tài Liệu Kartiki Gonsalves Ấn Độ Phim Lẻ"
91,Yêu (Kết hôn và ly dị) mùa 2,yeu-ket-hon-va-ly-di-mua-2,https://img.ophim.live/uploads/movies/yeu-ket-hon-va-ly-di-mua-2-thumb.jpg,Đang cập nhật,Hàn Quốc,2022,Phim Bộ,"Mọi thứ dần sụp đổ với ba phụ nữ chạy chương trình radio thành đạt khi các nút thắt, bước ngoặt và rắc rối nảy sinh trong những cuộc hôn nhân tưởng như hạnh phúc của họ.",Chính Kịch,http://localhost:5173/images/movies/https://img.ophim.live/uploads/movies/yeu-ket-hon-va-ly-di-mua-2-thumb.jpg,"Yêu (Kết hôn và ly dị) mùa 2 Mọi thứ dần sụp đổ với ba phụ nữ chạy chương trình radio thành đạt khi các nút thắt, bước ngoặt và rắc rối nảy sinh trong những cuộc hôn nhân tưởng như hạnh phúc của họ. Chính Kịch Đang cập nhật Hàn Quốc Phim Bộ"
92,Hộ vệ công lý,ho-ve-cong-ly,https://img.ophim.live/uploads/movies/ho-ve-cong-ly-thumb.jpg,Đang cập nhật,Quốc Gia Khác,2022,Phim Bộ,"Khi thủ lĩnh dường như không biết sợ của họ tự hủy hoại mình, nhóm siêu anh hùng lo lắng phải đương đầu với cái ác đang lan tràn trên thế giới và cả trong chính họ.",Bí Ẩn|Hành Động|Khoa Học|Phiêu Lưu|Viễn Tưởng,http://localhost:5173/images/movies/https://img.ophim.live/uploads/movies/ho-ve-cong-ly-thumb.jpg,"Hộ vệ công lý Khi thủ lĩnh dường như không biết sợ của họ tự hủy hoại mình, nhóm siêu anh hùng lo lắng phải đương đầu với cái ác đang lan tràn trên thế giới và cả trong chính họ. Bí Ẩn|Hành Động|Khoa Học|Phiêu Lưu|Viễn Tưởng Đang cập nhật Quốc Gia Khác Phim Bộ"
93,Ba mươi chín,ba-muoi-chin,https://img.ophim.live/uploads/movies/ba-muoi-chin-thumb.jpg,Đang cập nhật,Hàn Quốc,2022,Phim Bộ,"Dựa vào nhau qua bao hoạn nạn và gian khó, ba người bạn thân cùng sát cánh khi họ trải nghiệm cuộc sống, tình yêu và nỗi mất mát trước lúc bước sang tuổi 40.",Chính Kịch,http://localhost:5173/images/movies/https://img.ophim.live/uploads/movies/ba-muoi-chin-thumb.jpg,"Ba mươi chín Dựa vào nhau qua bao hoạn nạn và gian khó, ba người bạn thân cùng sát cánh khi họ trải nghiệm cuộc sống, tình yêu và nỗi mất mát trước lúc bước sang tuổi 40. Chính Kịch Đang cập nhật Hàn Quốc Phim Bộ"
94,Anna: Tiểu thư dựng chuyện,anna-tieu-thu-dung-chuyen,https://img.ophim.live/uploads/movies/anna-tieu-thu-dung-chuyen-thumb.jpg,Đang cập nhật,Âu Mỹ,2022,Phim Bộ,"Thương nhân táo bạo hay kẻ lừa đảo? Một nhà báo lần theo câu chuyện của Anna Delvey, người khiến giới thượng lưu New York tin rằng mình thừa kế một gia sản lớn ở Đức.",Chính Kịch,http://localhost:5173/images/movies/https://img.ophim.live/uploads/movies/anna-tieu-thu-dung-chuyen-thumb.jpg,"Anna: Tiểu thư dựng chuyện Thương nhân táo bạo hay kẻ lừa đảo? Một nhà báo lần theo câu chuyện của Anna Delvey, người khiến giới thượng lưu New York tin rằng mình thừa kế một gia sản lớn ở Đức. Chính Kịch Đang cập nhật Âu Mỹ Phim Bộ"
95,Chủ nghĩa ngoại hình,chu-nghia-ngoai-hinh,https://img.ophim.live/uploads/movies/chu-nghia-ngoai-hinh-thumb.jpg,Đang cập nhật,Hàn Quốc,2022,Phim Hoạt Hình,"Trong một thế giới chuộng vẻ bề ngoài, một học sinh cấp ba lạc loài sống cuộc sống hai mặt bằng cách thay phiên dùng hai cơ thể có ngoại hình đối lập hoàn toàn.",Chính Kịch,http://localhost:5173/images/movies/https://img.ophim.live/uploads/movies/chu-nghia-ngoai-hinh-thumb.jpg,"Chủ nghĩa ngoại hình Trong một thế giới chuộng vẻ bề ngoài, một học sinh cấp ba lạc loài sống cuộc sống hai mặt bằng cách thay phiên dùng hai cơ thể có ngoại hình đối lập hoàn toàn. Chính Kịch Đang cập nhật Hàn Quốc Phim Hoạt Hình"
96,Công Lý Mù,blind,https://img.ophim.live/uploads/movies/blind-thumb.jpg,Shin Yong Hwi,Hàn Quốc,2022,Phim Bộ,"Bộ phim kể về câu chuyện của những người bình thường bị oan trở thành nạn nhân của những tội ác khác nhau, thủ phạm của họ, và những người cố gắng truy bắt hung thủ.",Bí Ẩn|Hình Sự|Kinh Dị,http://localhost:5173/images/movies/https://img.ophim.live/uploads/movies/blind-thumb.jpg,"Công Lý Mù Bộ phim kể về câu chuyện của những người bình thường bị oan trở thành nạn nhân của những tội ác khác nhau, thủ phạm của họ, và những người cố gắng truy bắt hung thủ. Bí Ẩn|Hình Sự|Kinh Dị Shin Yong Hwi Hàn Quốc Phim Bộ"
